{"attestations":{"independently_authored_synthetic_material":true,"no_case_material_or_derivative":true,"open_world_absence_is_not_evidence":true},"base_snapshot":{"graph_schema_version":1,"graph_snapshot_content_identity":"sha256:8c08d96ab0ff34bc28dc79c82bdfae03e3f50321d53913586763856d7e94b000","graph_version":"gv1:d3970ccc479a767f5f016df19c44c322ed09acbf6a0cbedb4a6be7438dc92217"},"behavior_change":true,"change_id":"non-discriminating-binding-set","change_kind":"evolution","change_schema_version":1,"changes":[{"delta":"added","entry_kind":"node","evidence_source_ids":["nist-ai-rmf-1.0","nist-sp-800-30r1"],"id":"non-discriminating-binding-set","rationale":"addition"},{"delta":"added","entry_kind":"relation","evidence_source_ids":["nist-ai-rmf-1.0","nist-sp-800-30r1"],"id":"rationale-candidate-comparison-informs-non-discriminating-binding-set","rationale":"addition"}],"proposed_snapshot":{"graph_schema_version":1,"graph_snapshot_content_identity":"sha256:1a7cdb77088291654905f634331a6bb86ab094f1507bac90422bd598e59824d9","graph_version":"gv1:7023f08ecb8a7eb786bb316e11fb46287c0df390a7a34542b0b25a24db7ee6fd"},"public_issue":"https://github.com/maximalfocus/archsift/issues/125","regression_test_ids":["test_all_candidates_passing_the_binding_set_abstains_before_selection","test_credible_current_baseline_failure_keeps_a_discriminating_verdict","test_current_baseline_without_a_binding_failure_abstains_even_when_an_option_fails"],"synthetic_counterexample_ids":["all-candidates-pass-binding-set","current-baseline-without-binding-failure"]}
