{"attestations":{"independently_authored_synthetic_material":true,"no_case_material_or_derivative":true,"open_world_absence_is_not_evidence":true},"base_snapshot":{"graph_schema_version":1,"graph_snapshot_content_identity":"sha256:1a7cdb77088291654905f634331a6bb86ab094f1507bac90422bd598e59824d9","graph_version":"gv1:7023f08ecb8a7eb786bb316e11fb46287c0df390a7a34542b0b25a24db7ee6fd"},"behavior_change":true,"change_id":"declared-baseline-retention","change_kind":"evolution","change_schema_version":1,"changes":[{"delta":"added","entry_kind":"node","evidence_source_ids":["nist-ai-rmf-1.0","nist-sp-800-30r1"],"id":"baseline-retention-contradiction","rationale":"addition"},{"delta":"added","entry_kind":"relation","evidence_source_ids":["nist-ai-rmf-1.0","nist-sp-800-30r1"],"id":"rationale-contradiction-diagnostics-informs-baseline-retention-contradiction","rationale":"addition"}],"proposed_snapshot":{"graph_schema_version":1,"graph_snapshot_content_identity":"sha256:f87a3b9366d9a786f4e16ab6b57e88d4b06b2e6ee38cbb8d014d509741c23aa7","graph_version":"gv1:6b07fdbdc861049ea35c23c4e40f145e6b3cde1f0df1b37ec655d5e2bc5eb063"},"public_issue":"https://github.com/maximalfocus/archsift/issues/129","regression_test_ids":["test_declared_baseline_retention_beside_a_failing_baseline_is_a_contradiction","test_declared_baseline_retention_never_promotes_or_supports_a_candidate","test_declared_baseline_retention_satisfies_the_non_discriminating_prerequisite"],"synthetic_counterexample_ids":["declared-retention-beside-failing-baseline","declared-retention-on-non-discriminating-set"]}
