{"attestations":{"independently_authored_synthetic_material":true,"no_case_material_or_derivative":true,"open_world_absence_is_not_evidence":true},"base_snapshot":{"graph_schema_version":1,"graph_snapshot_content_identity":"sha256:44c83bed52b8ac83ae4246b2f5a43f359696ccf46276b04138f26276ec10f291","graph_version":"gv1:27959b78c32567a3b3267c749e08d7fd218c1e2aa315e412f02d290d19e71d06"},"behavior_change":true,"change_id":"verdict-invariant-unknown-comparison","change_kind":"evolution","change_schema_version":1,"changes":[{"delta":"added","entry_kind":"node","evidence_source_ids":["nist-ai-rmf-1.0","nist-sp-800-30r1"],"id":"comparison-result-unknown-non-decisive","rationale":"addition"},{"delta":"added","entry_kind":"relation","evidence_source_ids":["nist-ai-rmf-1.0","nist-sp-800-30r1"],"id":"rationale-candidate-comparison-informs-comparison-result-unknown-non-decisive","rationale":"addition"}],"proposed_snapshot":{"graph_schema_version":1,"graph_snapshot_content_identity":"sha256:8c08d96ab0ff34bc28dc79c82bdfae03e3f50321d53913586763856d7e94b000","graph_version":"gv1:d3970ccc479a767f5f016df19c44c322ed09acbf6a0cbedb4a6be7438dc92217"},"public_issue":"https://github.com/maximalfocus/archsift/issues/101","regression_test_ids":["test_unknown_comparison_materiality_fails_closed_above_bound","test_verdict_changing_unknown_comparison_remains_material","test_verdict_invariant_unknown_comparison_is_non_decisive"],"synthetic_counterexample_ids":["verdict-changing-unknown-comparison","verdict-invariant-unknown-comparison"]}
