{"attestations":{"independently_authored_synthetic_material":true,"no_case_material_or_derivative":true,"open_world_absence_is_not_evidence":true},"base_snapshot":{"graph_schema_version":1,"graph_snapshot_content_identity":"sha256:f87a3b9366d9a786f4e16ab6b57e88d4b06b2e6ee38cbb8d014d509741c23aa7","graph_version":"gv1:6b07fdbdc861049ea35c23c4e40f145e6b3cde1f0df1b37ec655d5e2bc5eb063"},"behavior_change":true,"change_id":"elicited-baselines","change_kind":"evolution","change_schema_version":1,"changes":[{"delta":"added","entry_kind":"node","evidence_source_ids":["nist-ai-rmf-1.0","w3c-prov-o-2013"],"id":"elicited-baseline-quantified-target","rationale":"addition"},{"delta":"added","entry_kind":"relation","evidence_source_ids":["nist-ai-rmf-1.0","w3c-prov-o-2013"],"id":"rationale-credible-evidence-informs-elicited-baseline-quantified-target","rationale":"addition"}],"proposed_snapshot":{"graph_schema_version":1,"graph_snapshot_content_identity":"sha256:65d5c9f1d5fb14f7e2278d9ff77313f7b3f07dd88b90afeb6c3e57e9c2020f09","graph_version":"gv1:973af320bc977a08da84c3c645a83baf7266c2e6112648d217c623fe11c2b657"},"public_issue":"https://github.com/maximalfocus/archsift/issues/133","regression_test_ids":["test_elicited_baseline_is_refused_for_a_quantified_target","test_elicited_baseline_is_refused_for_an_undeclared_target_kind","test_elicited_baseline_supports_a_no_regression_outcome"],"synthetic_counterexample_ids":["elicited-baseline-directional-outcome","elicited-baseline-quantified-target"]}
